{
  "asset": "btc",
  "window": "5m",
  "vol_window_secs": 300,
  "vol_floor": 0.25,
  "vol_ceiling": 0.80,
  "ou_enabled": false,
  "ou_theta": 0.0,
  "ou_mu": 0.0,
  "student_t_dof": 0.0,
  "momentum_lookback_secs": 60,
  "momentum_blend_floor": 0.30,
  "momentum_blend_ceiling": 0.80,
  "momentum_blend_max": 0.50,
  "trend_boost_max": 0.80,
  "trend_ramp_start": 1.5,
  "trend_ramp_full": 3.0,
  "persistence_base_rate": 0.50,
  "persistence_ramp_start": 0.10,
  "persistence_ramp_full": 0.25,
  "cal_scale": 1.0,
  "cal_drift": 0.0,
  "cal_drift_sigma": 0.0,
  "pes_size_buckets_usd": [10, 20],
  "pes_score_threshold": 0.0,
  "pes_min_expected_reward_dollars": 0.0,
  "pes_min_expected_reward_per_share": 0.0,
  "pes_min_lockup_floor": 1.0,
  "pes_max_spread": 0.40,
  "pes_max_quote_age_ms": 5000,
  "regime_boundary_high": 0.70
}
